Charity_Legal_Name,Charity_Website,Charity_Size,charity_ID,age
AUSTRALIANS IN MISSION TOGETHER,amtglobal.com.au,Large,3,112
Church Of Christ Belmore,www.belmorechurchofchrist.com,Small,57,116
The Australian Childrens Music Foundation Limited,www.acmf.com.au,Large,74,20
Uniting Church Australia - Jannali,http://jannali.unitingchurch.org.au,Small,88,45
Baptist Church Altona,www.altonabaptist.org.au,Small,130,97
Change Futures Ltd,www.changefutures.org.au,Large,139,8
ADEA Diabetes Research Foundation,www.diabetesresearch.org.au,Small,147,5
Shalom Media Australia Limited,www.shalomworld.org,Medium,171,7
St Vincent De Paul Society (NT) Inc,vinnies.org.au,Large,205,73
St Marys Catholic Church,https://www.stmarysmtevelyn.org.au,Small,265,43
Woolgoolga Surf Life Saving Club Inc.,http://www.woolgoolgaslsc.com,Small,283,90
St Finbar's Catholic Church Brighton East,http://pol.org.au/brightoneast,Small,308,78
Holy Apostolic Catholic Assyrian Church Of The East,www.assyrianchurch.org.au/,Large,435,48
Windsor District Baptist Church Emergency Relief Inc.,http://www.wdbc.org.au,Small,477,15
Broome State Emergency Service Unit (Inc),https://www.volunteer.com.au/volunteering-organisations/15585/broome-state-emergency-service,Small,503,24
Relationships Australia Inc,http://www.relationships.org.au,Large,549,70
The Big Umbrella Incorporated,https://thebigumbrella.org,Medium,569,11
The Trustee For Centrepoint Church Trust Fund,https://centrepoint.church,Medium,593,13
Katanning Regional Emergency Accomodation Centre Inc,www.kreac.net.au,Medium,627,32
Uniting Church In Australia Glenelg - St Andrews,https://www.standrewsuc.org.au/,Medium,643,45
Follow Baptist Church,follow.church,Medium,656,7
The Potters House Christian Fellowship Geelong,https://pottershousegeelong.com.au/,Small,691,33
St John's Community Care Limited,https://stjohnscommunitycare.org/,Large,728,25
Potters House Christian Center Launceston Inc,pottershouselaunceston.com.au,Small,768,36
Association Of Australian Medical Research Institutes Limited,https://www.aamri.org.au,Medium,800,12
Chapter Seven Limited,www.theretreat.org.au,Small,812,11
ONE LIGHT CHARITY FOUNDATION PUBLIC TRUST,www.onelightcharity.com,Medium,817,11
EPC BRISBANE OPERATIONS INC,www.epcbrisbane.org.au,Small,884,52
Community Links Wellbeing Ltd,www.communitylinks.org.au,Large,904,37
SISTERS OF THE NORTH INC,www.sotn.org.au,Small,914,2
Lakes Entrance Baptist Church,http://www.lebc.org.au,Small,923,42
The Trustee for Beit Rafael Benevolent Institution,www.beitrafael.org,Medium,978,10
The Roman Catholic Trust Corporation For The Diocese Of Cairns,www.centacarefnq.org,Large,1011,41
Diamond Women Ltd,https://www.diamondwomen.com.au,Medium,1014,16
APOSTOLIC FAITH MISSION VESSEL OF HONOUR INC,https://www.afmvesselofhonour.org.au,Small,1181,2
MORNINGTON PENINSULA FRIENDS OF LOSPALOS INCORPORATED,http://friendsoflospalos.org,Small,1199,3
St Bernadettes Catholic Church North Sunshine,https://www.cam1.org.au/sunshinenorth,Medium,1240,66
Christies Beach Baptist Church Inc,www.christiesbaptist.org.au,Small,1249,42
The Corp Of The T/Tees Of The Order Of The Sisters Of The Presentation In Qld,http://presentationsociety.org.au/congregations/queensland/,Large,1284,122
United Pentecostal Church Of Lynbrook Inc.,www.upclynbrook.com.au,Small,1302,69
The Moore Catchment Council (Inc),www.moorecatchment.org.au,Medium,1397,21
Job Futures Ltd,www.coact.org.au,Large,1432,24
Australia Zoo Wildlife Warriors Worldwide Ltd,www.wildlifewarriors.org.au/,Large,1457,20
Habitat Restoration Fund,hrfund.org,Small,1484,15
Gawad Kalinga Australia Ltd,gawadkalinga.org.au/,Small,1509,11
Holyoake Alice Springs Inc,https://holyoake-alice.org.au/,Medium,1571,33
Murray Mallee General Practice Network Incorporated,www.mmgpn.org.au,Large,1584,27
Good Shepherd Parish,http://www.goodshepherdpar.org.au,Small,1590,154
Reach 4 Your Future Foundation Inc.,www.reach4yourfuturefoundation.org,Small,1662,9
North Townsville Community Hub Inc,www.notch.org.au,Medium,1709,34
Council On The Ageing Queensland Ltd,www.cotaqld.org.au,Large,1710,29
Sri Guru Singh Sabha Sikh Cultural Society Of Victoria Incorporated,sgss.org.au,Large,1760,23
St Mary Star Of The Sea Catholic Church West Melbourne,https://www.stmaryswestmelbourne.org,Medium,1784,149
Financial Counsellors Association Of Western Australia Inc,http://financialcounsellors.org,Large,1785,37
River Church Australia Pty Ltd,www.riverchurchwhitsundays.org.au,Small,1791,7
Port City CC Limited,https://www.portcitycc.org.au,Medium,1812,5
Catholic Parish Of St Joseph Gilgandra,www.bathurst.catholic.org.au,Small,1829,107
BILLION BEES LTD,www.billionbees.com.au,Small,1856,1
Peel Community Kitchen Incorporated,www.peelcommunitykitchen.com.au,Small,1913,8
Deeper Christian Life Ministry Inc,www.dclm-au.org,Medium,1961,12
Om Australia Inc,https://ordinaryheroes.org.au/,Medium,1963,19
Richmond Community Service Inc,http://rcsi-neighbourhoodcentre.org,Medium,1968,32
Economic Justice Australia,https://www.ejaustralia.org.au,Medium,1971,32
Wildlife Preservation Society Of Australia Limited,www.aws.org.au,Small,1979,38
Bunyip District Uniting Church,www.bunyipdistrictunitingchurch.wordpress.com,Small,1988,3
Tassie Mums Inc.,www.tassiemums.org,Small,2002,6
Our Lady Of Perpetual Help Catholic Church Dromana,http://perpetualhelp.org.au,Small,2016,50
Australian Evaluation Society Limited,https://aes.asn.au,Medium,2034,40
Australian Health Humanitarian Aid Inc,www.ahha.org.au,Small,2048,14
Lions Village Licola Inc,https://www.licola.org.au,Large,2049,50
The Trustee For Firefighters Charity Fund Melbourne - Public Ancilliary Fund,www.firecharity.org.au,Medium,2050,12
Southlakes Anglican Parish Morisset,www.southlakes.org.au,Small,2056,42
St Marys Catholic Parish Seymour,http://pol.org.au/seymour,Small,2173,132
Youth Futures Incorporated,www.youthfutures.org.au,Large,2176,42
The Osborne Charitable Australian Overseas Relief Fund Limited,www.oya.com.au,Small,2195,16
Regional Housing Limited,www.regionalhousing.org.au,Large,2223,13
St Marys Catholic Church Ascot Vale,http://stmaryschurch.org.au,Small,2240,110
The Gold Coast Hindu Cultural Association Inc.,http://culture.goldcoasthindu.org/,Medium,2242,10
Into Our Hands Community Foundation Limited,www.intoourhandsfoundation.com.au,Small,2254,9
Kingdom Culture Church LTD,http://kingdomculturechurch.com.au,Medium,2262,8
Ranges Community Health,www.inspiro.org.au,Large,2279,27
Roads to Rehab - Nepal,www.roads-to-rehab-nepal.org,Small,2283,5
Lifeline Canberra Inc,www.lifelinecanberra.org.au,Large,2290,51
BAYSIDE MASONIC LODGES CHRISTMAS PARCELS.,freemasonscommunityrelief.org.au,Small,2353,30
The Awakening Network Inc.,www.awakeningnetwork.net,Small,2388,38
Arabanoo Before And After School Centre Inc,www.arabanoo.com,Large,2428,28
Helping Hands Mission Inc.,helpinghandsmission.org.au,Large,2453,11
Ipswich Cares Incorporated,http://www.ipswichcares.com,Small,2509,15
Alamein Neighbourhood And Learning Centre Inc,www.alameinnlc.com.au,Medium,2573,46
Echuca & Moama Search & Rescue Squad,www.emsr.org.au,Small,2623,56
Catholic Parish Of St.John The Baptist Gulgong,www.bathurst.catholic.org.au,Small,2632,132
Advocacy for Disability Access and Inclusion Inc.,www.advocacyfordisability.org.au,Medium,2658,37
Warrane Mornington Neighbourhood Centre Incorporated,https://www.warranemorningtonneighbourhoodcentreinc.org/,Medium,2666,37
Katherine & District Show Society Inc,www.katherineshow.org.au,Medium,2729,57
Pilgrim Uniting Church,www.pilgrim.org.au,Medium,2751,45
Agios Ministries,www.heartreachaustralia.com,Small,2760,32
Angel Feather Foundation Inc,www.angelfeatherfoundation/facebook,Small,2768,8
Mary Ward International Australia Limited,www.mwia.org.au,Large,2909,17
Whitsunday Housing Company Ltd,www.whcl.com.au,Large,2924,16
Radiology Across Borders Limited,www.radiologyacrossborders.org,Medium,2952,8
Revival Centres International- Townsville,http://www.revivalcentre.org,Small,2983,43
Catholic Parish Of St.Laurence O'Toole Molong,www.bathurst.catholic.org.au,Small,2994,140
Tweed District Rescue Squad Incorporated,www.tweedrescue.com.au,Small,3039,50
THE TRUSTEES OF THE ROMAN CATHOLIC CHURCH FOR THE DIOCESE OF LISMORE (ST VINCENT'S HOSPITAL),www.svh.org.au,Large,3064,101
OPEN FEED INCORPORATED,https://www.facebook.com/openfeedoz/,Medium,3089,2
The Potter's House Christian Centre (Bunbury),pottershousebunbury.com.au,Small,3108,40
Countrywide Community Missions Victoria Inc,www.ccmv.com.au,Small,3126,22
Holland Foundation,https://hf.org.au,Small,3135,18
Australian Search and Rescue K9 Incorporated,www.asark9.com.au,Small,3158,27
The Trustee For Downlands Foundation Trust,https://www.downlands.qld.edu.au/giving,Small,3170,23
Hearts and Hands Community Development,http://www.heartsandhands.net.au,Small,3178,9
BK 2 Basics Melbourne Incorporated,www.bk2basicsmelbourne.com,Small,3196,4
UCA - Gateway Family Services,www.gatewayfamilyservices.org.au,Large,3198,7
VISIONARY MINISTRIES INTERNATIONAL LIMITED,www.visionaryministries.net,Small,3235,3
Echo International Aid Ltd,www.echointernational.org.au,Small,3344,6
CATHOLIC PARISH OF MERNDA/WHITTLESEA,https://www.christthelightparish.org.au,Medium,3392,10
Pharmacists' Support Service,www.supportforpharmacists.org.au,Small,3394,12
St Josephs Catholic Church Black Rock,www.stmstj.com,Small,3454,92
Holy Cross Lutheran Church Birdwood Incorporated,www.birdwoodlutheranchurch.com.au,Small,3461,173
The Australia Day Council of Western Australia Inc.,www.auspire.org.au,Large,3509,45
United Christian Education Foundation Inc,https://ucefulladulla.wordpress.com/,Small,3537,24
The Southern Highlands Foundation,www.shfoundation.org.au,Small,3576,21
Historymaker Australia Limited,http://www.historymaker.org.au,Medium,3588,17
Christian Brethren Community Care Limited,www.temcare.org.au,Medium,3593,16
Aussie Action Abroad Ltd,www.aussieactionabroad.com,Small,3628,10
Uca - Scotts Memorial Congregation,https://www.scotschurch.com.au,Medium,3630,45
mental health families & friends TASMANIA Inc.,http://www.mhfamiliesfriendstas.org.au,Medium,3640,38
Solve Disability Solutions Inc,www.solve.org.au,Large,3701,47
Canberra Revival Fellowship Inc,revivalcanberra.com.au,Medium,3745,55
Whitehill Church Of Christ,whitehill.church,Medium,3762,58
Sacred Heart Catholic Church Croydon,www.sacredheartcroydon.org,Small,3787,29
Kyogle Together Incorporated,kyogletogether.org.au,Medium,3815,12
St Peters Catholic Church Toorak,http://pol.org.au/toorak,Small,3818,93
Treading Lightly Inc,https://tlinc.org.au/,Small,3865,2
Every Little Bit Helps Limited,www.elbh.org.au,Small,3876,4
Friends of Refugees Inc,www.for.org.au,Medium,3884,7
Mission2Myanmar,www.mission2myanmar.org,Small,3885,4
Operation Hope Australia Ltd,www.operationhopeaustralia.com,Small,3893,3
VETERINARIANS FOR CLIMATE ACTION LTD.,https://www.vfca.org.au/,Medium,3911,2
Anglican Church Of Australia Diocese Of Wangaratta Parish Of Murchison & Rushworth,sheppartonanglican.com,Small,3970,18
Anglesea Christian Fellowship Baptist Church,www.angleseabaptist.org.au,Medium,4054,36
St John's Catholic Church Heidelberg ,www.cam.org.au/heidelberg,Medium,4067,171
St Patricks Catholic Church Kilmore,http://pol.org.au/kilmore,Small,4082,173
The Source Church Stirling Inc,www.thesourcechurch.com.au,Medium,4149,63
The Trustee For Vipassana Charitable Trust,www.aloka.dhamma.org,Small,4165,30
Samadhi Buddhist Meditation Association Inc,https://www.samadhivihara.org.au,Small,4244,20
Grattan Institute,www.grattan.edu.au,Large,4246,13
St Joseph's Catholic Church West BruNSWick,http://www.bbe.org.au,Small,4253,109
Simply Stronger Pty Ltd,https://www.simplystronger.org.au (under construction),Small,4275,9
Returned & Services League Quinns Rocks Sub-branch,www.quinnsrockrsl.org.au,Small,4289,22
GENESIS CHURCH INCORPORATED,www.genesischurch.com.au,Small,4393,22
Daylesford Community Op Shop,https://daylesford-community-op-shop.business.site/,Small,4439,10
St Joseph's Parish Warragul,www.cdsale.org.au,Small,4441,135
Darling Range Wildlife Shelter,www.darlingrangewildlife.com.au,Small,4479,33
Holy Family Catholic Church Mt Waverley,https://holyfamily.melbourne,Medium,4501,64
Gethsemane Church Incorporated,gethsemane.com.au,Small,4505,5
Perth Concert Band Incorporated,http://wafesband.org.au/,Small,4512,102
MIT Group Foundation Ltd,http://mitgroupfoundation.org,Medium,4536,7
Give for Good Limited,http://www.giveforgood.org.au,Large,4561,5
I HOPE INTERNATIONAL LTD,www.ihopeinternational.org.au,Small,4584,2
Van Wyk Ministries Ltd,joynetwork.org,Small,4604,1
First Love Jesus Ministries,firstlovejesusministries.online,Small,4702,3
Foundation 1 Inc.,www.foundation1.org.au,Medium,4799,3
The Trustee For Beyond Bank Australia Foundation Master DGR Fund,www.beyondbank.com.au,Small,4814,12
breakthru Ltd,www.breakthru.org.au,Large,4902,21
Touched By Olivia Foundation Limited,www.touchedbyolivia.com.au/,Small,4921,15
Adelaide Primary Health Network Limited,www.adelaidephn.com.au,Large,4949,10
One Direct Connect Limited,www.ccmow.com.au,Large,4958,9
St Timothy's Catholic Church Forest Hill,https://www.sttimothys.org.au,Small,4979,54
Littlewood Charities Club Inc,www.charitiesplus.com.au,Small,5035,46
Westaus Crisis And Welfare Services Inc,http://www.westauscrisis.org.au/,Medium,5037,30
Wellsprings For Women Incorporated,www.wellspringsforwomen.com,Large,5052,27
Eastern Volunteer Resource Centre Inc,www.easternvolunteers.org.au,Large,5084,46
The Royal Life Saving Society Aust Tas Branch Inc,www.royallifesaving.com.au/tas,Medium,5085,107
St Johns Anglican Church Parish Of Willoughby Park,https://www.wpachurch.com.au,Medium,5091,97
Birallee Park Neighbourhood House Inc,birhouse.com.au,Small,5102,38
Northampton Old School Community Initiative Incorporated,http://www.nosci.com.au,Medium,5129,10
Wise Choices for Life Inc,www.wisechoicesforlife.org,Small,5144,10
Bridge for Asylum Seekers Incorporated,https://bridgeforasylumseekers.org.au,Medium,5171,1
Nourishing Neighbours Incorporated,https://www.nourishingneighbours.org.au,Small,5183,1
St Anne & St Gerard Catholic Church,https://www.cam1.org.au/parkorchardswarrandyte,Small,5198,52
Godfrey Street Community House Inc,http://www.godfreystreet.org,Medium,5214,35
Sacred Heart Catholic Church Diamond Creek,www.pol.org.au/diamondcreek,Small,5216,108
The Jewish National Fund (Australia) Pty Limited,www.jnf.org.au,Large,5239,6
Paws Pet Therapy Inc,www.pawspettherapy.com,Small,5267,9
UNITED MINDS COMMUNITY SERVICES LTD.,http://www.unitedminds.org.au/,Large,5271,3
Our Ladys Catholic Church Ringwood,http://pol.org.au/ringwood,Small,5296,102
Friends Of Baguia Inc,www.baguia.org.au,Small,5339,17
Evie Grace Inc.,https://eviegrace.org/,Small,5346,4
The Trustee For The Salvation Army (Vic) Social Work,https://www.salvationarmy.org.au/,Large,5347,13
Granville Multicultural Community Centre Incorporated,www.cmcs.org.au,Large,5353,45
Shining Stars Foundation,www.shiningstarsfoundation.org.au,Small,5455,5
St Paul Apostle Catholic Church Endeavour Hills,https://www.cam.org.au/endeavourhills,Medium,5457,42
The Dr Edward Koch Foundation Limited,www.kochfoundation.org.au,Small,5550,25
Relationships Australia South Australia,www.rasa.org.au,Large,5581,16
Communities@Work,www.commsatwork.org,Large,5587,15
Bethel House Ministries Ltd,www.gatewaychurch777.com,Small,5595,14
TRANSFORM THE NATIONS LTD,www.transformthenations.org,Medium,5614,9
Esterman Ministries International Incorporated,http://estermanministries.eklablog.com/,Small,5625,14
St Matthew's Anglican Parish Cheltenham,stmatthewscheltenham.org.au,Small,5627,155
Survivors & Mates Support Network Limited,https://www.samsn.org.au/,Large,5637,9
Stawell Neighbourhood House Inc.,http://www.snhlc.org.au,Small,5652,33
Kingston Neighbourhood House,https://kingstonnh.org.au/,Medium,5675,37
Habitat For Humanity Australia Sa Inc,https://www.habitat.org.au/what-we-do/australia/sa/,Medium,5682,33
Catholic Parish of St Joseph Newport and Spotswood,http://pol.org.au/newport,Small,5686,124
Jewish House Limited,www.jewishhouse.org.au,Large,5740,38
Chelsea Community Support Service Inc,www.chelsea.org.au,Small,5755,37
Wyndham Community & Education Centre Inc.,www.wyndhamcec.org.au,Large,5761,48
Corowa Rutherglen District Search Andrescue Squad Inc,rescue.org.au/squad/corowa-rescue-squad,Small,5774,31
Doing Good Charitable Fund,www.doinggoodfund.org,Small,5794,3
Gippsland Farmer Relief Incorporated,www.gippslandfarmerrelief.com.au,Small,5837,5
Notting Hill Community Association Inc,www.nottinghillnh.org.au,Small,5847,15
Wide Bay Sexual Assault Service Inc.,www.wbsass.com.au,Medium,5854,28
Adelaide University Union,www.auu.org.au,Large,5864,127
Kick On!,kickon.com.au,Small,5884,4
CLIMATE ANALYTICS AUSTRALIA LTD,https://climateanalytics.org/,Medium,5909,4
Cisarua Learning Limited,cisarualearning.com,Small,5914,4
Saint Anthony's Bread Pty Ltd,https://www.hkc.com.au,Large,5915,4
Orphan Aid Australia Incorporated,http://www.orphanaidaustralia.org.au,Medium,5928,3
RIMA FOUNDATION LIMITED,https://rima-foundation.org/,Small,5943,2
Sydney Male Choir Inc,sydneymalechoir.com.au,Small,5973,109
Social Justice Advocates of the Sapphire Coast,sjasc.org.au,Medium,6002,10
Tamworth Community College Incorporated,http://www.tamworth.nsw.edu.au,Large,6003,34
Therapeutic Engagement Support Services Association Incorporated,www.tessainc.org.au,Medium,6014,8
Ruth's Womens Shelter Cairns Inc,www.ruthswomenssheltercairns.com.au,Large,6053,44
The Trustee for Revival Centres International Mission Trust,revivalcentres.org/about-us/missions/,Small,6099,7
Giving Independence for Tomorrow (G.I.F.T) INC,https://gift.org.au/,Small,6113,8
Our Lady Help Of Christians Catholic Church - Narre Warren,www.cdsale.org.au,Medium,6128,42
Castlemaine Community House Incorporated,www.cch.org.au,Large,6238,33
Takreem e Shuhdah Foundation Limited,www.takreemshuhdah.org,Small,6293,12
Wagga Wagga Rescue Squad Incorporated,www.waggavra.com.au,Small,6299,72
Aspley Caring Through Service,https://aspleyacts.org.au/,Small,6346,10
Perth City Church,heartforthecity.church,Small,6348,10
Mornington Christian Church Inc.,morningtonchristianchurch.org.au,Small,6380,31
Wesleyan Methodist Church Coffs Harbour,www.coffswesleyan.org.au,Small,6401,45
Redland Community Centre Inc,www.redlandcommunitycentre.org,Large,6421,30
Renewal Ministries Fellowship Inc.,www.renewal.asn.au,Small,6537,13
Islamic Education & Welfare Association Of Dandenong,https://www.iewad.org.au,Small,6551,26
WAY FORWARD DEBT SOLUTIONS LIMITED,https://wayforward.org.au/,Large,6597,3
Bikes for Refugees SA Incorporated,adelaidebikeworkshop.wordpress.com,Small,6634,19
Wallaville Kindy-Care Inc,https://www.facebook.com/wallaville.kindycare?ref=bookmarks,Small,6657,47
Catholic Womens League State Of Queensland Inc,https://m.facebook.com/pg/CWLQLDabout/,Small,6658,66
Riverwood Community Centre LTD,http://riverwoodcommunity.org.au/,Large,6667,47
West Moonah Community Action Group Inc,westmoonahcommunityhouse.com,Medium,6676,37
Southern Care Incorporated,www.southernlife.org.au,Small,6727,24
Kororoit Creek Neighbourhood House Incorporated,https://www.kcnh.org.au/,Small,6749,5
Surf Life Saving Tasmania Inc,www.slst.asn.au,Large,6778,37
The Trustee For Strathewen Bushfire Relief Trust,www.strathewen.com.au,Small,6784,9
ENERGY AND WATER OMBUDSMAN (NSW) LIMITED,www.ewon.com.au,Large,6847,24
Buddha House Centre For Advanced Buddhist Studies Inc,buddhahouse.org/,Small,6892,41
Givit Listed Ltd,www.givit.org.au,Large,6902,13
Shelterbox Australia,https://www.shelterboxaustralia.org.au,Medium,6907,12
Kilmore District Mens Shed Inc.,www.kilmoremensshed.com,Small,6929,11
Bunbury Reformed Evangelical Church Inc.,www.gekabunbury.com.au,Small,7017,12
The Parks Community Network Incorporated,www.parkscommunity.org.au,Large,7022,29
COUNTERPOINT COMMUNITY SERVICES INCORPORATED,http://counterpointcs.org.au/,Large,7033,45
SpringDale Neighbourhood Centre Inc,www.springdale.org.au,Medium,7070,33
St Martin Of Tours Parish,http://www.smot.org.au,Small,7119,66
Accoras Limited,www.accoras.org.au,Large,7123,29
ChEd Nepal,www.chednepal.org,Small,7130,7
Albury Wodonga Community Chest Incorporated,https://www.revolutiontheatreproductions.org,Small,7180,25
Philemon Development & Aid,philemondevelopmentaid.org.au,Small,7202,31
HASENE AUSTRALIA LIMITED,https://www.hasene.org.au,Large,7214,5
People Reaching Out to People Limited,www.prop.org.au,Small,7216,5
Hayden's Helping Hands Limited,haydenshelpinghands.org/,Small,7218,5
Brunswick Baptist Church,brunswickbaptistchurch.org.au/,Small,7264,160
Church Of Christ Wollongong,www.newdaychurch.com.au,Large,7278,81
Multilink Community Services Inc,www.multilink.org.au,Large,7304,33
Clergy Remuneration And Retirement Fund Catholic Diocese Of Bathurst,www.bathurst.catholic.org.au,Small,7315,20
Womens Health Loddon Mallee Inc,www.whlm.org.au,Large,7334,33
Uca Trinity & Fijian Parish Dandenong,https://dandenong.ucavictas.org.au,Small,7342,45
God's Love Care Feed,https://www.facebook.com/GodsLCF/,Small,7354,10
Trustees Of The Ukrainian Catholic Church In Australia Eparchy Of St Peter And Paul Of Melbourne,https://catholicukes.org.au/,Large,7358,80
Holy Cross Catholic Church Caulfield South,http://pol.org.au/caulfieldsouth,Small,7360,96
Nalanda Institute (Australia) Inc,www.website.com,Small,7368,9
Revival Centres International - Mudgee,rci.org/mudgee,Small,7376,34
Resurrection Catholic Church Kings Park,https://www.resurrectionkingspark.org,Medium,7381,46
Shoalhaven Landcare Association Incorporated,www.shoalhavenlandcare.org.au,Small,7419,23
Cottage By The Sea Queenscliff Inc,cottagebythesea.com.au,Large,7438,131
Molonglo Support Services Ltd,https://molonglo.net.au,Large,7451,42
Illawarra Multicultural Services Inc,www.ims.org.au,Large,7455,42
The Trustee For The Salvation Army (Qld) Social Work,https://www.salvationarmy.org.au/,Large,7485,13
Mareeba Community Housing Company Ltd,https://www.mchc.org.au/,Large,7486,25
Woodrising Neighbourhood Centre Incorporated,www.woodrisingnc.org.au,Medium,7491,35
Chinese Health Foundation Of Australia,chinesehealthfoundation.com,Small,7505,28
Christ in You Fellowship,http://www.christinyoufellowship.org,Medium,7507,28
The Centre For Continuing Education Inc.,http://www.thecentre.vic.edu.au,Large,7565,60
The Freedom Project Ltd.,www.thefreedomproject.org,Small,7580,11
St Marys Parish Newborough,www.cdsale.org.au,Small,7585,36
Centre for Organic Research & Education Incorporated,www.core.asn.au,Small,7601,8
The Trustee For Rotary Club Of Keilor East Charitable Trust,www.keiloreastrotary.org,Small,7642,17
Energizer Foundation,www.yourchurch.org,Small,7644,8
Liverpool Baptist Church,www.liverpoolbaptist.org.au,Small,7787,85
Wish Foundation Limited,www.wishfoundation.com.au,Medium,7801,7
Penny Appeal Australia Ltd,www.pennyappeal.org.au,Large,7817,5
St Coleman Catholic Church - Orbost,www.cdsale.org.au,Small,7849,107
CANCER SUPPORT ANGELS LTD,www.cancersupportangels.org.au,Small,7874,2
St Marks Lutheran Church Melton,http://meltonsouth.lutheran.org.au/,Small,7923,45
Food Relief NQ Incorporated,www.foodreliefnq.org.au,Small,7929,19
Western Riverina Community College Incorporated,www.wrcc.nsw.edu.au,Large,7957,34
Chevra Hatzolah Sydney Inc,hatzolah.com.au,Medium,7962,18
Seconds To Give Inc.,www.secondstogive.org,Small,8067,15
The Gianna Centre Inc,www.gianna.org.au,Small,8087,18
Victorian Council Of Social Service,www.vcoss.org.au,Large,8106,76
Cbm Australia,https://www.cbm.org.au,Large,8109,53
MAA INTERNATIONAL LTD.,www.maainternational.org.au,Large,8129,31
Private Cancer Physicians Of Australia Limited,www.pcpa.org.au,Small,8186,15
Berri Barmera Lutheran Church Incorporated,www.lca.org.au,Small,8206,2
Charlotte Pass Volunteer Ski Patrol Association Incorporated,http://www.cpskipatrol.org,Small,8210,3
Islamic Help Australia,www.islamichelp.org.au,Medium,8231,8
SaferToodyay Inc.,https://www.safertoodyay.org.au,Small,8239,3
Seymour Nagambie & Yea Presbyterian Church Federal Board,http://seymour.preschurch.org.au,Small,8301,47
Gethsemane Community Incorporated,www.gethsemanecommunity.org.au,Small,8366,30
Melbourne Tautoko Whanua Inc,http://www.mtw.org.au,Small,8383,7
Sacred Heart Catholic Church Yea,http://masstimes.melbournecatholic.org.au/Yea,Small,8399,132
Stable Help Incorp,stables.org.au,Small,8403,24
St Andrew's Catholic Church Clayton South,http://www.standrewsclaytonsouth.org.au,Medium,8408,40
PFLAG TAS Inc,http://www.pflagtasmania.org.au,Small,8413,28
Trustees Of The Roman Catholic Church For The Diocese Of Bathurst,www.bathurst.catholic.org.au,Small,8424,157
Hepburn Wildlife Shelter Inc.,www.hepburnwildlifeshelter.org,Small,8435,17
Catholic Social Services Victoria,http://www.css.org.au,Medium,8597,30
St Marys Church Maffra,www.cdsale.org.au,Small,8659,106
The Trustee For The Salvation Army (Tas) Social Work,https://www.salvationarmy.org.au/,Large,8680,13
Flame Tree Baptist Church,https://www.flametree.org.au/,Medium,8694,110
Mallacoota and District Recovery Association Inc,madrecovery.com,Small,8738,2
Australian And New Zealand Laboratory Animal Association Inc,http://www.anzlaa.org,Small,8741,14
Crosslink Training & Discipling Centre,https://reddog999000.wixsite.com/crosslink-church,Small,8758,31
Our Lady Of The Immaculate Conception Catholic Church Sunshine,http://masstimes.melbournecatholic.org.au/Sunshine,Small,8805,95
Anglicare Foundation Funds,www.anglicare.org.au,Large,8830,38
Blue Mountains City Church Limited,www.citychurchau.com,Large,8862,40
Brave Foundation,bravefoundation.org.au/,Large,8870,13
Australia Palestine Advocacy Network Incorporated,https://apan.org.au/,Medium,8878,10
Projects Against Poverty Foundation Australia Ltd,www.papfa.org.au,Small,8881,10
Central Service Office Gold Coast Incorporated,https://aa.org.au/,Small,8917,22
Woodville Uniting Church,www.wuca.org.au,Small,8921,45
St Mark's Catholic Church Fawkner,http://pol.org.au/fawkner,Small,8953,78
Forster Neighbourhood Centre Inc,www.fnc.org.au,Medium,8971,42
