Charity_Legal_Name,Charity_Website,Charity_Size,charity_ID,age
Volunteer Marine Rescue Bundaberg Incorporated,www.vmrbundaberg.com.au,Small,41242,44
I Am Someone Inc,www.iamsomeone.org.au,Small,41251,16
St Patricks Catholic Church Murrumbeena,murrumbeena@cam.org.au,Small,41301,70
The Pinjarra Church Of The Christian & Missionary Alliance Of Australia,http://www.pinjarracma.org.au/,Small,41306,45
Womens Health In The North Inc,http://www.whin.org.au,Large,41337,30
BlazeAid Incorporated,www.blazeaid.com.au,Large,41359,12
Motivational Media Ltd ,https://www.motivationalmedia.org.au/,Small,41440,7
Streethearts,http://www.streethearts.org.au,Small,41513,12
Churches Of Christ In South Australia And Northern Territory Inc Inc,https://www.churchesofchrist-sa.org.au,Medium,41551,109
Broome Lotteries House Inc,www.broomelotterieshouse.org.au,Small,41571,29
The Trustee For The Aon Charitable Foundation,www.aon.com,Medium,41595,17
St Andrews Anglican Church Lakemba,http://www.lakembaanglican.org/,Small,41621,94
Australian Unity Trustees Foundation,https://www.australianunity.com.au/pfs/trustee-home/philanthropic-service,Small,41664,4
Catholic Parish Of St Lawrence Coonabarabran,www.bathurst.catholic.org.au,Small,41668,130
The Trustee for Daarul Arqam Trust,www.daarularqam.com.au,Medium,41684,1
Boambee East Community Centre Inc,https://becc.org.au/,Medium,41690,27
Northern Volunteering Sa Inc,northernvolunteering.org.au,Medium,41704,38
Weipa Community Care Assn Inc,www.weipacommunitycare.com,Large,41717,36
The Trustee For Gateway Foundation,gatewaycommunitycare.net.au,Medium,41731,10
Royal Life Saving Society Of Australia (New South Wales Branch),http://www.royalnsw.com.au,Large,41738,128
National Children's And Youth Law Centre,https://yla.org.au,Medium,41776,29
St Agnes' Church Highett,https://www.sahighett.org.au,Small,41782,71
Joyce Meyer Ministries,https://joycemeyer.org/,Large,41786,26
Worship Ministries International Ltd,www.worshipministriesinternational.com,Small,41790,24
Life Unlimited Church Ltd,https://lifeuc.com.au/,Large,41797,22
THE COMPASSIONATE FRIENDS AUSTRALIA LIMITED,https://tcfa.org.au/,Small,41847,12
Holy Eucharist Catholic Church St Albans South,http://www.holyeuchariststalbans.org,Small,41921,50
Pivot Support Services (Incorporated),pivotsupport.com.au,Large,41935,17
Central Highlands Group Training Incorporated,www.bgt.org.au,Large,41947,36
Capricornia Catchments Inc.,www.capcatchments.org.au,Medium,41963,17
Centacare New England North West,www.centacarenenw.com.au,Large,42068,22
Catholic Parish of St Joseph Newport and Spotswood,https://www.smmspotswood.catholic.edu.au,Small,42074,86
Eyre Peninsula Disaster Fund,http://www.epcf.com.au,Small,42097,16
Aberdeen Hall Limited,www.aberdeenhall.org,Small,42103,7
The Australian Landscape Science Institute Limited,www.tals.org.au,Small,42139,3
APMHA HEALTHCARE LIMITED,http://www.apmhahealthcare.com.au,Large,42142,2
PEOPLE HELPING PEOPLE AUSTRALIA LTD,www.phpaustralia.com.au,Small,42167,1
St Theresas Catholic Church Albion,http://pol.org.au/albion,Small,42185,53
St John's Catholic Church - Kooweerup,www.cdsale.org.au,Small,42269,76
Northern Rivers Preschool Alliance Association Inc,www.northernriverspreschoolalliance.com.au,Small,42271,8
Woden Valley Alliance Church Incorporated,www.alliancechurch.com.au,Medium,42405,51
St Veronica Welfare Committee,www.stveronica.org.au,Medium,42421,23
YWCA Australia,www.ywca.org.au,Large,42466,18
Australian Suicide Prevention Foundation,http://www.aspf.org,Small,42468,17
St Patrick's Community Support Centre Limited,https://stpats.com.au,Large,42472,50
Bowen Community Council Inc,www.bowenneighbourhoodcentre.com.au,Medium,42473,36
Backpacker Medics Inc.,www.backpackermedics.org,Small,42493,5
Australia and New Zealand Chapter of the Association for Contextual Behavioral Science,http://www.anzacbs.com,Small,42526,8
Community Services Industry Alliance Limited,www.csialtd.com.au,Large,42528,8
Bankstown Womens Health Centre,www.bwhc.org.au,Large,42535,44
THE TRUSTEE FOR INTO OUR HANDS PUBLIC FUND,intoourhandsfoundation.com.au,Small,42543,10
Adelaide and Hills Koala Rescue -1300KOALAZ Inc,www.1300koalaz.com,Small,42544,2
Australian international aid,www.aiaid.org.au,Medium,42545,9
Southside Christian Fellowship Incorporated,southside.org.au,Medium,42557,48
Lak Saviya Foundation Australia Inc.,http://www.laksaviya.org.au/,Small,42563,18
Multilingual Broadcasting Council Northern Territory Inc,https://www.mcnt.org.au/,Small,42564,41
ATC Foundation,www.atcfoundation.com.au,Medium,42567,3
Umeewarra Aboriginal Media Assn Inc,https://www.umeewarramedia.com/,Medium,42587,34
St Monica's Catholic Church Footscray,http://pol.org.au/footscray,Small,42614,132
C3 - GITC Vision Builders,www.godinthecity.com.au,Small,42617,4
Revival From Down Under Incorporated,www.rfdu.com,Small,42655,20
Pay it forward,https://www.facebook.com/groups/468702809991305/,Small,42683,2
St Marys Catholic Church Dandenong,http://www.stmarysdandenong.org,Medium,42741,139
One Hope Foundation Ltd,www.houseofhopeafrica.org,Small,42766,5
Ss Peter & Paul's Catholic Church Doncaster East,http://www.sspp.org.au,Small,42799,62
COBARGO WELLNESS GROUP LTD,www.cobargowellnessgroup.org.au,Small,42819,1
Bayside Kindergarten and Childcare,http://baysidekindy.qld.edu.au,Large,42839,29
Young Seeds Foundation of Tasmania Inc,www.youngseeds.org.au,Small,42861,11
All Saints Catholic Church Fitzroy,http://www.allsaintsfitzroy.org,Small,42907,63
In Christ Chapel Australia Inc,http://www.inchristchapel.org,Small,42919,1
Tamil Christian Fellowship Melbourne Inc.,www.tcfmelbourne.org,Small,42927,3
Clothes4U Inc.,www.clothes4urosebud.org,Small,42942,9
St Michaels Catholic Church Ashburton,https://sites.google.com/view/st-michaels-parish-ashburton,Small,42958,76
C Care Inc.,www.ccare.org.au,Medium,42963,11
Women With Disabilities ACT Incorporated,http://www.wwdact.org.au,Small,42972,5
The International Nepal Fellowship (Australia) Limited,https://inf.org.au,Large,43081,60
Daystar Foundation,www.daystar.org.au,Medium,43094,21
Caboolture Community Care Inc,https://caboolturecommunitycare.org.au/,Medium,43117,36
Children's Rights International,https://www.childjustice.org/,Small,43118,16
St Carthages Catholic Church Parkville,http://www.stcarthagesparkville.org.au,Medium,43141,66
Hunter Melanoma Foundation Inc,hmf.org.au,Small,43186,34
Heathmont Inter Church Help Inc,www.hich.com.au,Small,43197,30
North Coast Radio Incorporated,http://www.2ncr.org.au,Small,43203,23
Good Shepherd Catholic Church,http://pol.org.au/gladstonepark,Small,43251,47
St Raphaels Catholic Church West Preston,http://www.straphaelswestpreston.org.au,Small,43252,77
St Gerards Catholic Church North Dandenong,https://www.stgerards.org.au/,Medium,43281,66
Elizabeth South Community Centre Inc,http://www.communitywebs.org/escc/,Small,43403,8
Suburban Church Inc,https://suburbanchurch.org,Medium,43407,35
R C Flemington Kensington Foundation,https://www.rotaryflemington.org.au/stories/rotary-club-of-flemington-kensington-foundation,Small,43410,2
Vivability Limited,https://vivability.org.au/,Large,43469,39
INTERNATIONAL HUMAN CARE AND RELIEF ORGANIZATION AUSTRALIA (IHCRO),https://ihcroaustralia.org,Large,43498,2
LIFE CHRISTIAN CHURCH ROMA LTD,www.lccr.org.au,Medium,43499,2
United Nations Association Of Australia Qld Inc,https://www.unaa.org.au/about/state-teams/queensland/,Small,43538,33
Mallacoota District Health & Support Service Inc,http://www.mallacoota.org.au,Large,43541,36
Hebron Christian Fellowship Inc.,https://hebron.org.au/,Small,43543,11
One Heart Church Inc,www.oneheartchurch.com.au,Medium,43569,13
John's Safe Haven,http://www.johnssafehaven.com.au,Small,43606,2
Uca - Ocean Grove,oceangrove.unitingchurch.org.au,Small,43610,45
My Community Legal Inc.,http://www.mycommunitylegal.org.au,Small,43617,8
Grace Bible Fellowship Inc.,gbf.org.au,Small,43618,12
Merindah Childrens Centre Inc,www.merindah.org.au,Large,43683,31
Southeast Christian Church Inc,https://www.facebook.com/PJ1953.53/,Small,43686,8
Welfare Rights Centre Ltd,https://welfarerightscentre.org.au/,Large,43710,39
INCH Housing Inc.,www.inchhousing.org.au,Large,43713,31
Guilford Young College,www.gyc.tas.edu.au,Large,43727,28
Northern Rivers Community Gateway Incorporated,http://www.nrcg.org.au,Large,43730,36
Obadiah Life Renewal Centre Incorporated,www.obadiahvillage.com.au,Medium,43731,33
Ryde Hunters Hill Symphony Orchestra,www.rhhso.org.au,Small,43751,11
Anglicare - Central Queensland Limited,www.anglicarecq.org.au,Large,43782,23
Western Research Institute Limited,www.wri.org.au,Medium,43784,23
North Victorian Buddhist Association,https://www.dahamniketanaya.org.au/,Medium,43901,28
Hobart Community Legal Service,www.hobartlegal.org.au,Large,43952,37
Micah Projects Ltd,www.micahprojects.org.au,Large,43977,27
Leichhardt Community Group Inc,www.lcginc.org.au,Medium,43990,38
St Joseph's Roman Catholic Church Wonthaggi,www.cdsale.org.au,Small,44098,111
Sewing for Charity Australia Ltd,www.sewingforcharity.com,Small,44110,6
Alleviate Ltd.,www.alleviate.org.au,Small,44113,5
THE REDEEMED CHRISTIAN CHURCH OF GOD WESTERN AUSTRALIA KINGCITY,www.kingscity.church,Small,44211,4
Blue Mountains Hawkesbury & Penrith Schools Industry Partnership Inc,https://schoolsindustry.com.au,Large,44263,17
BRIGHT FUTURES CHILD AID AND DEVELOPMENT FUND AUSTRALIA LIMITED,www.brightfutures.com.au,Medium,44268,17
STRATHEWEN PUBLIC HALL INC,www.strathewenhall.com,Small,44367,23
Innovative Disability Employment And Liaison Placements Assn Inc,www.idealplacements.com.au,Large,44399,27
MAHAMEVNAWA BUDDHIST MONASTERY OF MELBOURNE,www.mahamevnawa.org.au,Medium,44484,11
Ravenshoe Community Centre Inc - Rural & Remote Home Care Services,www.ravenshoecommunitycentre.org.au,Small,44487,33
Uniting Church In Australia Frontier Services,www.frontierservices.org,Large,44517,110
Rural Outreach Counselling Incorporated,www.ruraloutreachcounselling.com.au,Small,44520,4
GFA World Inc,www.gfaau.org,Large,44523,17
Pregnancy & Family Support Assoc Gold Coast Inc,www.pregnancyfamilysupport.org,Medium,44528,40
Highfields Church of Christ,www.highfieldschurch.org,Small,44531,21
Korean Lifeline,http://koreanlifeline.org,Small,44534,18
Drug and Alcohol Health Services Incorporated,http://drugandalcoholhealthservices.com.au/our-locations/upper-hunter/,Medium,44549,33
Hunter Hampers Incorporated,https://www.facebook.com/groups/1729092947209000/?ref=share,Small,44555,2
St Ignatius Catholic Church Richmond,https://www.ignatius.org.au,Medium,44571,155
Companions for Life Pet Rescue,http://www.companionsforlife.com.au,Small,44582,12
Lakes Entrance Neighbourhood House Inc,www.lakesnhouse.org,Small,44638,21
Dunga Derby Fraser Coast Inc.,www.rallyforacause.org.au,Small,44642,7
Neighbourhood Centre In Greenhills Inc,www.ghnh.org.au,Medium,44664,38
St Christopher's Catholic Church Syndal,http://www.cam.org.au/syndal,Medium,44676,61
Volunteer Marine Rescue Burdekin Inc.,https://www.facebook.com/pages/category/Community/Volunteer-Marine-Rescue-Burdekin-463856700418111/,Small,44702,51
YMCA Camping Limited,https://victoria.ymca.org.au/programs-and-services/camps,Large,44724,6
The Young Boxing Woman Inc,https://www.theyoungboxingwomanproject.com,Small,44728,5
YOURPLACE HOUSING LTD,www.yourplacehousing.com.au,Large,44777,2
Community Northern Beaches Incorporated,www.cnb.org.au,Large,44834,23
Copticare Relief Fund Limited,www.copts.org.au,Large,44846,36
The Blueline Laundry Inc,http://www.blueline-laundry.com,Large,44852,48
Orana Community Centre Inc,https://www.orana.org.au,Small,44909,36
Saint Mary Magdalens Catholic Church Trentham,http://www.kynetontotrentham.org,Small,44917,117
Australind State Emergency Service Unit Inc,https://www.facebook.com/AustralindStateEmergencyService,Small,44926,28
Community Care Plus Incorporated,http://www.communitycareplus.org.au,Small,44927,4
EAGLEHAWK COMMUNITY HOUSE INCORPORATED,www.eaglehawkcommunityhouse.com,Small,44959,37
Safe and Equal Inc,www.safeandequal.org.au,Large,44962,44
Kith And Kin Association Limited,www.kithandkin.com.au,Large,44993,41
Cancer Council Of The Northern Territory Incorporated,nt.cancer.org.au/,Large,45008,43
DAISI Services Limited,www.daisi.asn.au,Large,45017,30
Operation Rainbow Australia Limited,www.operationrainbow.org.au,Small,45029,27
Apex Australia Charitable Fund Inc,https://www.apex.org.au,Small,45059,91
Fitted For Work Limited,www.fittedforwork.org/,Large,45077,15
Adara Development (Australia),https://www.adaragroup.org,Large,45083,14
Neighbourhood Centre Caboolture Inc,https://www.caboolturenhc.com.au,Medium,45109,34
Congregational Church Wollongong,www.wollongongcongchurch.org,Small,45159,167
Tasmanian Council of Churches - Emergencies Ministry Inc.,https://www.tccem.org.au,Small,45212,5
Helem Yumba Incorproated,www.cqhealing.com.au,Large,45218,15
Ski For Life Incorporated,www.skiforlife.com.au,Small,45230,8
Victorian Medical Benevolent Association Incorporated,http://www.vmba.org.au,Medium,45242,157
St Macartans Catholic Church Mornington,https://www.stmacartansparish.com.au,Medium,45273,124
St Peter The Apostle Catholic Church East Keilor,http://pol.org.au/keiloreast,Small,45324,52
St John Vianney's Catholic Church Mulgrave,st.john.vianney.mulgrave@gmail.com,Medium,45386,57
VICTORY OUTREACH AUSTRALIA LIMITED,www.vosydney.org,Small,45411,6
Hope Support Services Australia Ltd,www.hopesupport.com.au,Large,45436,3
Two Green Threads Ltd.,twogreenthreads.org,Small,45444,2
Kindness Factory Australia Ltd,www.kindnessfactory.com,Small,45450,2
STRONG COMMUNITIES LTD,https://strongcommunities.org.au/,Small,45458,2
Gnowangerup Baptist Church (Incorporated),gnowangerupcc.com.au,Small,45589,102
Christ Centred Ministry Inc,www.ccmaustralia.org,Small,45598,8
Healesville Living & Learning Centre Inc,https://hllc.org.au/,Medium,45606,43
Escare Inc,www.escare.org.au,Large,45627,40
Ararat Neighbourhood House,www.araratneighbourhoodhouse.com.au,Small,45678,36
Childfund Australia,https://www.childfund.org.au,Large,45715,37
Quest For Life Foundation,http://www.questforlife.org.au,Large,45716,32
Assembly of God Paradise Incorporated,www.influencers.church,Large,45733,102
One Thousand Villages,www.onethousandvillages.org,Small,45736,21
Congo Aid Incorporated,www.congoaid.org,Small,45759,13
Port Lincoln Aboriginal Health Service Inc,www.plahs.org.au,Large,45844,29
Mental Health Victoria Ltd,www.mhvic.org.au,Large,45860,36
Manning Valley Neighbourhood Services Inc,www.mvns.org.au,Medium,45870,41
Khacho Yulo Ling Buddhist Centre Incorporated,www.yuloling.com,Small,45880,18
St Therese's Catholic Church Essendon,https://www.stthereses.org.au,Medium,45904,100
Presbyterian Church Of Australia Parishof Gulgong,https://gulgongpresbyterian.org/,Small,45911,150
Heritage Bank Charitable Foundation,https://www.heritagecharitablefoundation.org.au,Medium,45927,3
Volunteering Victoria Incorporated,www.volunteeringvictoria.org.au,Large,45973,45
Lutheran Church Queensland Australian Disaster Relief Fund,https://www.qlg.org.au/,Small,45995,5
Citizens Radio Emergency Service Teams Victoria Incorporated,http://www.crestvic.org.au,Small,46013,44
Uca - Wanda Street Mulgrave,https://mulgraveunitingchurch.org.au/,Small,46067,45
St Kevin's Catholic Church Ormond,http://pol.org.au/murrumbeena,Small,46071,94
Malipai (Aust) Limited,www.malipai.org,Small,46117,10
OZZY CARE LIMITED,www.ozzycare.org.au,Small,46140,2
Australian-Palestinianpartnerships In Education And Health Incorporated,http://appeh.org.au,Small,46189,12
Vietnamese Evangelical Church In Australia Perth,tinlanhperth.org,Medium,46241,41
Northwestern Community Church A Church Of Christ,http://www.nwcc.org.au/,Small,46258,22
Holy Cross Lutheran Church Education And Fellowship Centre,www.birdwoodlutheranchurch.com.au,Small,46262,26
Emergency Services Foundation Trust,www.esf.com.au,Medium,46273,16
Adult and Community Education Victoria Incorporated,https://www.acevic.org.au/,Small,46284,33
Backpacks 4 SA Kids Inc,www.backpacks4sakids.org,Medium,46317,12
Centro Church,http://www.centrochurch.com.au,Medium,46318,67
Tumaini Miles of Smiles Australia Inc.,https://www.facebook.com/Tumaini-Miles-of-Smiles-Australia-Inc-357883594233986/,Small,46320,7
Happy Paws Haven Inc,www.happypawshaven.com.au,Small,46338,16
The Missionary Oblates Of Mary Immaculate,www.oblates.com.au,Medium,46340,206
Lincoln Park Horse and Human Rehabilitation Centre,www.lincolnparkhhrc.com.au,Small,46341,3
Gladstone PAWS Incorporated,http://www.gladstonepaws.com,Small,46347,3
Council On The Ageing Wa Inc,http://www.cotawa.org.au,Large,46359,63
Ananda Marga Universal Relief Team Ltd.,www.amurt.org.au,Small,46377,36
Victorian Animal Aid Trust,www.animalaid.org.au,Large,46378,74
Our Lady Of The Assumption Catholic Church Cheltenham,http://www.olacheltenham.org.au,Medium,46402,64
Northshore Unit Of The West Australian State Emergency Service,http://www.northshoreses.com.au/,Small,46406,23
The Repat Foundation Incorporated,http://www.mesha.org.au,Large,46425,29
Wollongong Homeless Hub and Housing Services,www.wefh.org.au,Large,46427,40
Supportlink Australia Limited,www.Supportlink.com.au,Large,46459,16
St Laurence's Catholic Church - Leongatha,www.cdsale.org.au,Small,46478,121
The Centre For Women & Co. Ltd,http://www.centreforwomen.org.au,Large,46504,30
Smile Outreach Foundation Ltd,http://www.smileoutreach.org,Small,46506,10
W R E B Co-Op Ltd,www.outbackradio.com.au,Large,46533,44
Scientific and Support Staff Benevolent Association Incorporated,https://donate.mycause.com.au/charity/46904,Small,46540,7
St Joseph's Catholic Church Northcote,http://pol.org.au/northcote,Small,46547,129
Global Advance Projects Inc.,www.globaladvanceprojects.org,Small,46568,2
Enveco Association Incorporated,www.enveco.org.au,Small,46652,14
Good Shepherd Lutheran Church Para Vista Inc,https://paravista.org.au/,Medium,46714,56
Woden Community Service Incorporated,www.wcs.org.au/,Large,46722,46
Guanaba South Coast Country Music Club Inc,www.facebook.com/guanabacountrymusicclub,Small,46724,34
Rotary Australia Relief Fund,www.rawcs.org.au,Medium,46766,6
Fur Life Foundation Ltd,www.apiam.com.au,Small,46797,4
P & G PURPOSE AUSTRALIA LIMITED,https://pgpurpose.org/,Small,46803,3
Lions V Districts Cancer Foundation Inc,http://lionsvdcf.org.au/,Medium,46921,2
Enfield Heights Church Of Christ,http://www.churchesofchrist-sa.org.au,Small,46951,23
The Trustee For Marysville and Triangle Community Foundation,www.marysvilletrianglefoundation.org.au,Small,46956,9
The Anglican Parish of The Wollombi Valley,https://www.parishofthewollombivalley.org/,Small,46983,75
Fingal Beach Surf Life Saving Club incorporated,https://www.fingalbeachslsc.com,Small,46987,58
WENDOUREE NEIGHBOURHOOD CENTRE INC,www.wnc.org.au,Medium,46989,18
Nightlight,www.nightlight.org.au,Small,47008,18
Darebin Information Volunteer & Resource Service Incorporated,www.divrs.org.au,Medium,47014,46
St Leonards Catholic Church Glen Waverley,http://pol.org.au/glenwaverley,Medium,47024,37
Brisbane Multicultural Arts Centre Limited,www.bemac.org.au,Medium,47033,35
St John The Baptist Church Ferntree Gully,http://www.stjohnthebaptist.net.au,Medium,47036,111
St Marys Cathedral Parish Sale,www.cdsale.org.au,Medium,47060,149
Peninsula Vineyard Community Church,www.peninsulachurch.org/,Small,47097,16
Light Of Hope Limited,lightofhope.org.au,Small,47111,26
Southern Grampians Life Centres Inc,www.sglifecentre.com.au,Small,47127,35
Unlimited CRC Inc,http://www.unlimitedcrc.com.au,Small,47146,23
Lifetime Connect Limited,https://lifetimeconnect.org.au,Large,47177,36
Legal Aid Commission Of NSW,www.legalaid.nsw.gov.au,Large,47206,43
Community Early Learning Australia Limited.,https://www.cela.org.au/,Large,47209,44
Roberta Jull Community Care Association Inc,minnahouse.org.au,Medium,47210,40
Anglican Parish Of Mid Richmond,www.anglicanmidrichmond.com,Small,47212,48
Jewish National Fund Environmental Association Of Australia Inc,www.jnf.org.au,Large,47238,27
Richmond Churches Food Centre Incorporated,http://richmondchurches.weebly.com/,Small,47243,2
Baptist Care (Sa) Incorporated,www.baptistcaresa.org.au/,Large,47250,14
Jim & Debra Walker Ministries Incorporated,http://www.jdwalkerministries.com,Small,47272,20
Switchboard (Victoria) Inc,www.switchboard.org.au,Large,47311,25
Yacaaba Centre Information & Counselling Service Port Stephens Incorporated,www.yacaabacentre.com.au,Medium,47319,33
North East Community Assistance Project Inc,www.necap.org.au,Small,47331,42
St Brendan's Catholic Church Flemington,https://flemkencatholic.com,Small,47375,131
Rotary Action Group for Family Safety Inc,http://www.ragfamsafe.org,Small,47378,4
St Vincent De Paul Catholic Church Strathmore,http://pol.org.au/strathmore,Small,47388,81
The Cat Protection Society of NSW Limited,www.catprotection.org.au,Large,47450,44
Aboriginal & Torres Strait Islander Community Health Service Mackay Ltd,www.atsichs.org.au,Large,47466,43
The Harris Family Seeds of Hope Foundation No. 2,https://www.harrisfamilysoh.org,Small,47527,4
Bellarine Gateway Anglican Parish,www.bgap.church,Small,47539,55
Deaf Action Ltd,https://deafmin.org/deaf-action/,Medium,47542,15
Saint Francis Xavier's Catholic Church Frankston,https://www.frankstoncatholic.com.au,Small,47548,95
Australian Capital Territory Council Of Social Service Inc,www.actcoss.org.au,Large,47614,60
Word In Heart International Ministries Australia,https://wordnheart925872165.wordpress.com,Small,47615,8
Hunter Christian Life Centre Incorporated,hunterchristianlifecentre.org.au,Small,47649,25
Western Sydney Community Legal Centre Limited,www.wsclc.org.au,Large,47688,44
Surfers Paradise Assembly of God Property Holdings Ltd,www.presence.org.au,Large,47720,33
Project Underdog Rescue Inc,https://projectunderdogrescue.org.au,Small,47815,6
The MindShift Foundation,www.mindshift.org.au,Small,47844,10
Truc Lam Zen Incorporated,truclamphucduc.org.au,Small,47867,13
Sakks - Supporting Aussie Kids With Kabuki Syndrome Incorporated,https://sakks.org,Small,47920,14
Community Mental Health Australia Incorporated,www.cmha.org.au,Large,47940,15
Woodbine Neighbourhood Centre Incorporated,www.woodbinenc.org.au,Small,47941,35
Coast Watch Radio And Marine Rescue Squad Incorporated,www.coastwatchoceangrove.com.au/,Small,47945,47
The South Burnett Pantry Inc,http://www.thesouthburnettpantryinc.org,Small,47958,10
Maffra Neighbourhood House Inc.,https://maffranh.wixsite.com/maffranh,Small,47963,17
Winmalee Neighbourhood Centre Inc,www.winmaleeneighbourhoodcentre.com.au,Medium,48005,32
St Thomas Mores Catholic Church Mt Eliza,http://pol.org.au/mounteliza/Home.aspx,Small,48031,43
Nepean Therapy Dogs Incorporated,www.therapydogs.com.au,Small,48086,23
The Chai Charitable Foundation Ltd,www.chai.org.au,Large,48135,5
Australian Independent Schools Fund Limited,www.aisnsw.edu.au,Small,48144,4
The Sunlight Centre NFP Ltd,www.sunlightcentre.com.au,Small,48145,4
Buchan District Outreach Inc,buchan.vic.au,Small,48193,35
THE ENDEAVOUR HILLS NEIGHBOURHOOD CENTRE INC.,https://www.ehillsnc.org.au,Medium,48215,5
The Trustee For Family Challenge Charitable Trust,www.familychallenge.com.au,Small,48218,19
Peace Australasia inc,www.peaceaustralasia.com.au,Small,48231,4
Community Development Services Inc,https://mysd.com.au/cds,Medium,48239,36
Youth on Fire WA Incorporated,https://www.facebook.com/YouthOnFireWA/,Small,48284,4
Mindaribba Local Aboriginal Land Council,https://m.facebook.com.mindaribba,Large,48296,26
Port Melbourne Middle Park Parish,https://sj-mc.org.au,Medium,48327,113
Baptist Church Merrylands,www.merrylandsbaptist.org.au,Small,48420,54
Shoalhaven Suicide Prevention & Awareness Network Incorporated,www.sspan.org.au,Small,48424,11
St Mary's Church Lancefield,http://pol.org.au/lancefield,Small,48429,116
Lifecity Church Brisbane,www.lifecity.com.au,Medium,48460,22
St Josephs Catholic Church Elsternwick,http://pol.org.au/elsternwick,Small,48473,97
Cultural Diversity Network International,www.cdninternational.net,Small,48490,11
Friends of The Pound (Tweed) Inc,www.friendsofthepound.com,Medium,48505,19
Top End Lutheran Parish,www.darwinlutheranchurch.org.au,Small,48559,26
Erac Australia,http://www.lifelinealburywodonga.org.au,Large,48562,8
The Potters House Maroochydore,pottershousesunshinecoast.com.au,Small,48585,2
Quang Duc Buddhist Welfare Association Of Victoria Inc,www.quangduc.com.au,Small,48599,31
Western Sydney Community Centre Incorporated,www.wscci.org.au,Large,48632,7
Calvary Worship Centre Incorporated,cwc.org.au,Medium,48666,36
Williamstown Baptist Church,www.bethtephillah.com,Small,48674,153
St Anthonys Catholic Church Noble Park,https://www.stanthonysparish.net,Medium,48724,66
Keith Lutheran Church,www.facebook.com/bordertownlutheranparish,Small,48770,56
PROJECT4CHANGE limited,https://www.project4change.org.au,Small,48797,7
The Trustee For Jccv Cultural Fund,www.jccv.org.au,Medium,48859,14
AUSTRALIAN FIRST RESPONDER FOUNDATION LTD,https://afrf.com.au,Small,48860,1
Miracle Restoration Ministries Inc.,miraclerestoration.org,Small,48897,7
Mackay Advocacy Inc,www.mackayadvocacy.com.au,Medium,48899,28
Burnie Crusade Centre Incorporated,https://burniecitychurch.com,Medium,48916,45
Wicen (NSW) Inc.,https://nsw.wicen.org.au,Small,48929,33
Tathra Surf Life Saving Club Inc,http://www.tathrasurfclub.org.au,Small,48944,113
The Preventatists Incorporated,http://www.thepreventatists.com,Small,49010,14
Healthy Cities Illawarra Incorporated,www.healthycities.org.au,Large,49055,32
Australian Relief & Mercy Services Limited,www.australianmercy.org.au,Large,49098,33
Presbyterian Church Of Australia In The State Of NSW Parish Of Toukley,https://toukleypc.org.au,Small,49106,70
Help A Friend Club Toowoomba Inc,http://www.hafc.org.au,Large,49107,39
Australian Haemophilia Centre Directors Organisation,www.ahcdo.org.au,Large,49121,21
Samaritan's Purse - Australia Limited,www.samaritanspurse.org.au,Large,49138,27
Anglican Parish Of Onkaparinga Valley,murray.anglican.org,Medium,49159,173
